<hivemq-microsoft-sql-server-extension xmlns:xsi="http://www.w3.org/2001/XMLSchema-instance"
                        xsi:noNamespaceSchemaLocation="config.xsd">
    <mssqls>
        <mssql>
            <id>my-mssql-id</id>
            <server-name>my.host.com</server-name>
            <port>1433</port>
            <database>my-database</database>
            <authentication>
                <basic>
                    <username>my-user</username>
                    <password>my-password</password>
                </basic>
            </authentication>
        </mssql>
    </mssqls>

    <mqtt-to-mssql-routes>
        <mqtt-to-mssql-route>
            <id>my-mqtt-to-mssql-route-insert</id>
            <mssql-id>my-mssql-id</mssql-id>
            <mqtt-topic-filters>
                <mqtt-topic-filter>#</mqtt-topic-filter>
            </mqtt-topic-filters>
            <processor>
                <insert-statement>
                    <table>mqtt_to_mssql_table</table>
                    <use-bulk-copy>true</use-bulk-copy>
                    <columns>
                        <column>
                            <name>topic</name>
                            <value>mqtt-topic</value>
                        </column>
                        <column>
                            <name>payload_utf8</name>
                            <value>mqtt-payload-utf8</value>
                        </column>
                    </columns>
                </insert-statement>
            </processor>
        </mqtt-to-mssql-route>
    </mqtt-to-mssql-routes>
</hivemq-microsoft-sql-server-extension>
